{
    "$schema": "http://json-schema.org/schema#",
    "properties": {
        "attributes": {
            "items": {
                "properties": {
                    "name": {
                        "type": "string"
                    },
                    "url": {
                        "type": "string"
                    }
                },
                "required": [
                    "name",
                    "url"
                ],
                "type": "object"
            },
            "type": "array"
        },
        "baby_trigger_for": {
            "anyOf": [
                {
                    "type": "null"
                },
                {
                    "properties": {
                        "url": {
                            "type": "string"
                        }
                    },
                    "required": [
                        "url"
                    ],
                    "type": "object"
                }
            ]
        },
        "category": {
            "properties": {
                "name": {
                    "type": "string"
                },
                "url": {
                    "type": "string"
                }
            },
            "required": [
                "name",
                "url"
            ],
            "type": "object"
        },
        "cost": {
            "type": "integer"
        },
        "effect_entries": {
            "items": {
                "properties": {
                    "effect": {
                        "type": "string"
                    },
                    "language": {
                        "properties": {
                            "name": {
                                "type": "string"
                            },
                            "url": {
                                "type": "string"
                            }
                        },
                        "required": [
                            "name",
                            "url"
                        ],
                        "type": "object"
                    },
                    "short_effect": {
                        "type": "string"
                    }
                },
                "required": [
                    "effect",
                    "language",
                    "short_effect"
                ],
                "type": "object"
            },
            "type": "array"
        },
        "flavor_text_entries": {
            "items": {
                "properties": {
                    "language": {
                        "properties": {
                            "name": {
                                "type": "string"
                            },
                            "url": {
                                "type": "string"
                            }
                        },
                        "required": [
                            "name",
                            "url"
                        ],
                        "type": "object"
                    },
                    "text": {
                        "type": "string"
                    },
                    "version_group": {
                        "properties": {
                            "name": {
                                "type": "string"
                            },
                            "url": {
                                "type": "string"
                            }
                        },
                        "required": [
                            "name",
                            "url"
                        ],
                        "type": "object"
                    }
                },
                "required": [
                    "language",
                    "text",
                    "version_group"
                ],
                "type": "object"
            },
            "type": "array"
        },
        "fling_effect": {
            "anyOf": [
                {
                    "type": "null"
                },
                {
                    "properties": {
                        "name": {
                            "type": "string"
                        },
                        "url": {
                            "type": "string"
                        }
                    },
                    "required": [
                        "name",
                        "url"
                    ],
                    "type": "object"
                }
            ]
        },
        "fling_power": {
            "type": [
                "integer",
                "null"
            ]
        },
        "game_indices": {
            "items": {
                "properties": {
                    "game_index": {
                        "type": "integer"
                    },
                    "generation": {
                        "properties": {
                            "name": {
                                "type": "string"
                            },
                            "url": {
                                "type": "string"
                            }
                        },
                        "required": [
                            "name",
                            "url"
                        ],
                        "type": "object"
                    }
                },
                "required": [
                    "game_index",
                    "generation"
                ],
                "type": "object"
            },
            "type": "array"
        },
        "held_by_pokemon": {
            "items": {
                "properties": {
                    "pokemon": {
                        "properties": {
                            "name": {
                                "type": "string"
                            },
                            "url": {
                                "type": "string"
                            }
                        },
                        "required": [
                            "name",
                            "url"
                        ],
                        "type": "object"
                    },
                    "version_details": {
                        "items": {
                            "properties": {
                                "rarity": {
                                    "type": "integer"
                                },
                                "version": {
                                    "properties": {
                                        "name": {
                                            "type": "string"
                                        },
                                        "url": {
                                            "type": "string"
                                        }
                                    },
                                    "required": [
                                        "name",
                                        "url"
                                    ],
                                    "type": "object"
                                }
                            },
                            "required": [
                                "rarity",
                                "version"
                            ],
                            "type": "object"
                        },
                        "type": "array"
                    }
                },
                "required": [
                    "pokemon",
                    "version_details"
                ],
                "type": "object"
            },
            "type": "array"
        },
        "id": {
            "type": "integer"
        },
        "machines": {
            "items": {
                "properties": {
                    "machine": {
                        "properties": {
                            "url": {
                                "type": "string"
                            }
                        },
                        "required": [
                            "url"
                        ],
                        "type": "object"
                    },
                    "version_group": {
                        "properties": {
                            "name": {
                                "type": "string"
                            },
                            "url": {
                                "type": "string"
                            }
                        },
                        "required": [
                            "name",
                            "url"
                        ],
                        "type": "object"
                    }
                },
                "required": [
                    "machine",
                    "version_group"
                ],
                "type": "object"
            },
            "type": "array"
        },
        "name": {
            "type": "string"
        },
        "names": {
            "items": {
                "properties": {
                    "language": {
                        "properties": {
                            "name": {
                                "type": "string"
                            },
                            "url": {
                                "type": "string"
                            }
                        },
                        "required": [
                            "name",
                            "url"
                        ],
                        "type": "object"
                    },
                    "name": {
                        "type": "string"
                    }
                },
                "required": [
                    "language",
                    "name"
                ],
                "type": "object"
            },
            "type": "array"
        },
        "sprites": {
            "properties": {
                "default": {
                    "type": "string"
                }
            },
            "required": [
                "default"
            ],
            "type": "object"
        }
    },
    "required": [
        "attributes",
        "baby_trigger_for",
        "category",
        "cost",
        "effect_entries",
        "flavor_text_entries",
        "fling_effect",
        "fling_power",
        "game_indices",
        "held_by_pokemon",
        "id",
        "machines",
        "name",
        "names",
        "sprites"
    ],
    "type": "object"
}