{
    "attributes": [],
    "baby_trigger_for": null,
    "category": {
        "name": "evolution",
        "url": "http://localhost/api/v2/item-category/10/"
    },
    "cost": 2100,
    "effect_entries": [
        {
            "effect": "Held by Dusclops: Evolves the holder into Dusknoir when traded.",
            "language": {
                "name": "en",
                "url": "http://localhost/api/v2/language/9/"
            },
            "short_effect": "Traded on a Dusclops: Holder evolves into Dusknoir."
        }
    ],
    "flavor_text_entries": [
        {
            "language": {
                "name": "ja-kanji",
                "url": "http://localhost/api/v2/language/11/"
            },
            "text": "\u304a\u305d\u308d\u3057\u304f\u3000\u5f37\u3044\u3000\u970a\u529b\u304c\n\u3053\u3081\u3089\u308c\u3066\u3044\u308b\u3000\u5e03\u3002\n\u3042\u308b\u3000\u30dd\u30b1\u30e2\u30f3\u304c\u3000\u597d\u3093\u3067\u3044\u308b\u3002",
            "version_group": {
                "name": "x-y",
                "url": "http://localhost/api/v2/version-group/15/"
            }
        },
        {
            "language": {
                "name": "en",
                "url": "http://localhost/api/v2/language/9/"
            },
            "text": "A cloth imbued with horrifyingly\nstrong spiritual energy.\nIt\u2019s loved by a certain Pok\u00e9mon.",
            "version_group": {
                "name": "x-y",
                "url": "http://localhost/api/v2/version-group/15/"
            }
        },
        {
            "language": {
                "name": "it",
                "url": "http://localhost/api/v2/language/8/"
            },
            "text": "Panno intriso di un\u2019energia spirituale terribilmente\nforte. Piace a un Pok\u00e9mon in particolare.",
            "version_group": {
                "name": "x-y",
                "url": "http://localhost/api/v2/version-group/15/"
            }
        },
        {
            "language": {
                "name": "es",
                "url": "http://localhost/api/v2/language/7/"
            },
            "text": "Ataca al objetivo con un potente rayo, pero quien\nlo usa debe descansar en el siguiente turno para\nreponer energ\u00eda.",
            "version_group": {
                "name": "x-y",
                "url": "http://localhost/api/v2/version-group/15/"
            }
        },
        {
            "language": {
                "name": "de",
                "url": "http://localhost/api/v2/language/6/"
            },
            "text": "Ein Stoffumhang mit geistiger Energie.\nDas Lieblingsst\u00fcck eines bestimmten Pok\u00e9mon.",
            "version_group": {
                "name": "x-y",
                "url": "http://localhost/api/v2/version-group/15/"
            }
        },
        {
            "language": {
                "name": "fr",
                "url": "http://localhost/api/v2/language/5/"
            },
            "text": "Un tissu impr\u00e9gn\u00e9 d\u2019une \u00e9nergie spirituelle\nhorriblement puissante. Appr\u00e9ci\u00e9 d\u2019un certain\nPok\u00e9mon.",
            "version_group": {
                "name": "x-y",
                "url": "http://localhost/api/v2/version-group/15/"
            }
        },
        {
            "language": {
                "name": "ko",
                "url": "http://localhost/api/v2/language/3/"
            },
            "text": "\ubb34\uc12d\uace0 \uac15\ud55c \uc601\ub825\uc774\n\ub2f4\uaca8 \uc788\ub294 \ucc9c.\n\uc5b4\ub5a4 \ud3ec\ucf13\ubaac\uc774 \uc88b\uc544\ud558\ub294 \ubb3c\uac74\uc774\ub2e4.",
            "version_group": {
                "name": "x-y",
                "url": "http://localhost/api/v2/version-group/15/"
            }
        },
        {
            "language": {
                "name": "ja",
                "url": "http://localhost/api/v2/language/1/"
            },
            "text": "\u304a\u305d\u308d\u3057\u304f\u3000\u3064\u3088\u3044\u3000\u308c\u3044\u308a\u3087\u304f\u304c\n\u3053\u3081\u3089\u308c\u3066\u3044\u308b\u3000\u306c\u306e\u3002\n\u3042\u308b\u3000\u30dd\u30b1\u30e2\u30f3\u304c\u3000\u3053\u306e\u3093\u3067\u3044\u308b\u3002",
            "version_group": {
                "name": "x-y",
                "url": "http://localhost/api/v2/version-group/15/"
            }
        },
        {
            "language": {
                "name": "en",
                "url": "http://localhost/api/v2/language/9/"
            },
            "text": "A cloth imbued with horrifyingly strong\nspiritual energy.\nIt is loved by a certain Pok\u00e9mon.",
            "version_group": {
                "name": "black-2-white-2",
                "url": "http://localhost/api/v2/version-group/14/"
            }
        },
        {
            "language": {
                "name": "en",
                "url": "http://localhost/api/v2/language/9/"
            },
            "text": "A cloth imbued with horrifyingly strong\nspiritual energy.\nIt is loved by a certain Pok\u00e9mon.",
            "version_group": {
                "name": "black-white",
                "url": "http://localhost/api/v2/version-group/11/"
            }
        },
        {
            "language": {
                "name": "fr",
                "url": "http://localhost/api/v2/language/5/"
            },
            "text": "Un tissu impr\u00e9gn\u00e9 d\u2019une \u00e9nergie\nspirituelle horriblement puissante.\nAppr\u00e9ci\u00e9 d\u2019un certain Pok\u00e9mon.",
            "version_group": {
                "name": "black-white",
                "url": "http://localhost/api/v2/version-group/11/"
            }
        },
        {
            "language": {
                "name": "en",
                "url": "http://localhost/api/v2/language/9/"
            },
            "text": "A cloth imbued with horrifyingly strong\nspiritual energy.\nIt is loved by a certain Pok\u00e9mon.",
            "version_group": {
                "name": "heartgold-soulsilver",
                "url": "http://localhost/api/v2/version-group/10/"
            }
        },
        {
            "language": {
                "name": "en",
                "url": "http://localhost/api/v2/language/9/"
            },
            "text": "A cloth imbued with horrifyingly strong\nspiritual energy.\nIt is loved by a certain Pok\u00e9mon.",
            "version_group": {
                "name": "platinum",
                "url": "http://localhost/api/v2/version-group/9/"
            }
        },
        {
            "language": {
                "name": "en",
                "url": "http://localhost/api/v2/language/9/"
            },
            "text": "A cloth imbued with horrifyingly strong\nspiritual energy.\nIt is loved by a certain Pok\u00e9mon.",
            "version_group": {
                "name": "diamond-pearl",
                "url": "http://localhost/api/v2/version-group/8/"
            }
        }
    ],
    "fling_effect": null,
    "fling_power": 10,
    "game_indices": [
        {
            "game_index": 325,
            "generation": {
                "name": "generation-vi",
                "url": "http://localhost/api/v2/generation/6/"
            }
        },
        {
            "game_index": 325,
            "generation": {
                "name": "generation-v",
                "url": "http://localhost/api/v2/generation/5/"
            }
        },
        {
            "game_index": 325,
            "generation": {
                "name": "generation-iv",
                "url": "http://localhost/api/v2/generation/4/"
            }
        }
    ],
    "held_by_pokemon": [],
    "id": 302,
    "machines": [],
    "name": "reaper-cloth",
    "names": [
        {
            "language": {
                "name": "en",
                "url": "http://localhost/api/v2/language/9/"
            },
            "name": "Reaper Cloth"
        },
        {
            "language": {
                "name": "it",
                "url": "http://localhost/api/v2/language/8/"
            },
            "name": "Terrorpanno"
        },
        {
            "language": {
                "name": "es",
                "url": "http://localhost/api/v2/language/7/"
            },
            "name": "Tela Terrible"
        },
        {
            "language": {
                "name": "de",
                "url": "http://localhost/api/v2/language/6/"
            },
            "name": "D\u00fcsterumhang"
        },
        {
            "language": {
                "name": "fr",
                "url": "http://localhost/api/v2/language/5/"
            },
            "name": "Tissu Fauche"
        },
        {
            "language": {
                "name": "ko",
                "url": "http://localhost/api/v2/language/3/"
            },
            "name": "\uc601\uacc4\uc758\ucc9c"
        },
        {
            "language": {
                "name": "ja",
                "url": "http://localhost/api/v2/language/1/"
            },
            "name": "\u308c\u3044\u304b\u3044\u306e\u306c\u306e"
        }
    ],
    "sprites": {
        "default": "http://localhost/media/sprites/items/reaper-cloth.png"
    }
}
