{"category":{"url":"http:\/\/127.0.0.1:8000\/api\/v2\/item-category\/12\/","name":"held-items"},"name":"power-herb","fling_effect":null,"effect_entries":[{"short_effect":"Held: Both turns of a two-turn charge move happen at once. Consumed upon use.","effect":"Held: Whenever the holder uses a move that requires a turn to charge first (Bounce, Dig, Dive, Fly, Razor Wind, Skull Bash, Sky Attack, or Solarbeam), this item is consumed and the charge is skipped.  Skull Bash still provides a Defense boost.","language":{"url":"http:\/\/127.0.0.1:8000\/api\/v2\/language\/9\/","name":"en"}}],"held_by_pokemon":[],"sprites":{"default":"http:\/\/127.0.0.1:8000\/media\/sprites\/items\/power-herb.png"},"game_indices":[{"generation":{"url":"http:\/\/127.0.0.1:8000\/api\/v2\/generation\/6\/","name":"generation-vi"},"game_index":271},{"generation":{"url":"http:\/\/127.0.0.1:8000\/api\/v2\/generation\/5\/","name":"generation-v"},"game_index":271},{"generation":{"url":"http:\/\/127.0.0.1:8000\/api\/v2\/generation\/4\/","name":"generation-iv"},"game_index":271}],"baby_trigger_for":null,"cost":100,"names":[{"name":"Power Herb","language":{"url":"http:\/\/127.0.0.1:8000\/api\/v2\/language\/9\/","name":"en"}},{"name":"Vigorerba","language":{"url":"http:\/\/127.0.0.1:8000\/api\/v2\/language\/8\/","name":"it"}},{"name":"Hierba \u00danica","language":{"url":"http:\/\/127.0.0.1:8000\/api\/v2\/language\/7\/","name":"es"}},{"name":"Energiekraut","language":{"url":"http:\/\/127.0.0.1:8000\/api\/v2\/language\/6\/","name":"de"}},{"name":"Herbe Pouvoir","language":{"url":"http:\/\/127.0.0.1:8000\/api\/v2\/language\/5\/","name":"fr"}},{"name":"\ud30c\uc6cc\ud480\ud5c8\ube0c","language":{"url":"http:\/\/127.0.0.1:8000\/api\/v2\/language\/3\/","name":"ko"}},{"name":"\u30d1\u30ef\u30d5\u30eb\u30cf\u30fc\u30d6","language":{"url":"http:\/\/127.0.0.1:8000\/api\/v2\/language\/1\/","name":"ja"}}],"attributes":[{"url":"http:\/\/127.0.0.1:8000\/api\/v2\/item-attribute\/5\/","name":"holdable"},{"url":"http:\/\/127.0.0.1:8000\/api\/v2\/item-attribute\/7\/","name":"holdable-active"}],"flavor_text_entries":[{"text":"\u6301\u305f\u305b\u305f\u3000\u30dd\u30b1\u30e2\u30f3\u306f\u3000\uff11\u5ea6\u3060\u3051\n\uff11\u30bf\u30fc\u30f3\u76ee\u306b\u3000\u3061\u304b\u3089\u3092\u3000\u305f\u3081\u308b\u6280\u3092\n\u3059\u3050\u306b\u3000\u4f7f\u3046\u3053\u3068\u304c\u3000\u3067\u304d\u308b\u3002","version_group":{"url":"http:\/\/127.0.0.1:8000\/api\/v2\/version-group\/15\/","name":"x-y"},"language":{"url":"http:\/\/127.0.0.1:8000\/api\/v2\/language\/11\/","name":"ja-kanji"}},{"text":"A single-use item to be held by a Pok\u00e9mon.\nIt allows the holder to immediately use a\nmove that normally requires a turn to charge.","version_group":{"url":"http:\/\/127.0.0.1:8000\/api\/v2\/version-group\/15\/","name":"x-y"},"language":{"url":"http:\/\/127.0.0.1:8000\/api\/v2\/language\/9\/","name":"en"}},{"text":"Strumento monouso da dare a un Pok\u00e9mon.\nPermette l\u2019uso immediato di una mossa che in\ngenere richiede un turno prima di essere eseguita.","version_group":{"url":"http:\/\/127.0.0.1:8000\/api\/v2\/version-group\/15\/","name":"x-y"},"language":{"url":"http:\/\/127.0.0.1:8000\/api\/v2\/language\/8\/","name":"it"}},{"text":"Da\u00f1a en cada turno al Pok\u00e9mon que la lleva.\nPuede adherirse al Pok\u00e9mon que alcance con su\nataque al portador.","version_group":{"url":"http:\/\/127.0.0.1:8000\/api\/v2\/version-group\/15\/","name":"x-y"},"language":{"url":"http:\/\/127.0.0.1:8000\/api\/v2\/language\/7\/","name":"es"}},{"text":"Ein Item zum einmaligen Tragen. Der Tr\u00e4ger kann\ndadurch eine Attacke sofort einsetzen, die sonst\naufgeladen werden muss.","version_group":{"url":"http:\/\/127.0.0.1:8000\/api\/v2\/version-group\/15\/","name":"x-y"},"language":{"url":"http:\/\/127.0.0.1:8000\/api\/v2\/language\/6\/","name":"de"}},{"text":"Objet \u00e0 tenir et \u00e0 usage unique. Permet d\u2019utiliser\nimm\u00e9diatement une capacit\u00e9 qui devrait se\ncharger au premier tour.","version_group":{"url":"http:\/\/127.0.0.1:8000\/api\/v2\/version-group\/15\/","name":"x-y"},"language":{"url":"http:\/\/127.0.0.1:8000\/api\/v2\/language\/5\/","name":"fr"}},{"text":"\uc9c0\ub2c8\uac8c \ud55c \ud3ec\ucf13\ubaac\uc740 \ud55c \ubc88\ub9cc\n1\ud134\uc9f8\uc5d0 \ud798\uc744 \ubaa8\uc73c\ub294 \uae30\uc220\uc744\n\ubc14\ub85c \uc0ac\uc6a9\ud560 \uc218\uac00 \uc788\ub2e4.","version_group":{"url":"http:\/\/127.0.0.1:8000\/api\/v2\/version-group\/15\/","name":"x-y"},"language":{"url":"http:\/\/127.0.0.1:8000\/api\/v2\/language\/3\/","name":"ko"}},{"text":"\u3082\u305f\u305b\u305f\u3000\u30dd\u30b1\u30e2\u30f3\u306f\u3000\u3044\u3061\u3069\u3060\u3051\n\uff11\u30bf\u30fc\u30f3\u3081\u306b\u3000\u3061\u304b\u3089\u3092\u3000\u305f\u3081\u308b\u308f\u3056\u3092\n\u3059\u3050\u306b\u3000\u3064\u304b\u3046\u3053\u3068\u304c\u3000\u3067\u304d\u308b\u3002","version_group":{"url":"http:\/\/127.0.0.1:8000\/api\/v2\/version-group\/15\/","name":"x-y"},"language":{"url":"http:\/\/127.0.0.1:8000\/api\/v2\/language\/1\/","name":"ja"}},{"text":"A single-use item to be held by a\nPok\u00e9mon. It allows the immediate use of\na move that charges on the first turn.","version_group":{"url":"http:\/\/127.0.0.1:8000\/api\/v2\/version-group\/14\/","name":"black-2-white-2"},"language":{"url":"http:\/\/127.0.0.1:8000\/api\/v2\/language\/9\/","name":"en"}},{"text":"A single-use item to be held by a\nPok\u00e9mon. It allows the immediate use of\na move that charges on the first turn.","version_group":{"url":"http:\/\/127.0.0.1:8000\/api\/v2\/version-group\/11\/","name":"black-white"},"language":{"url":"http:\/\/127.0.0.1:8000\/api\/v2\/language\/9\/","name":"en"}},{"text":"Objet \u00e0 tenir et \u00e0 usage unique. Permet\nd\u2019utiliser imm\u00e9diatement une capacit\u00e9\nqui devrait se charger au premier tour.","version_group":{"url":"http:\/\/127.0.0.1:8000\/api\/v2\/version-group\/11\/","name":"black-white"},"language":{"url":"http:\/\/127.0.0.1:8000\/api\/v2\/language\/5\/","name":"fr"}},{"text":"A single-use item to be held by a\nPok\u00e9mon. It allows the immediate use of\na move that charges on the first turn.","version_group":{"url":"http:\/\/127.0.0.1:8000\/api\/v2\/version-group\/10\/","name":"heartgold-soulsilver"},"language":{"url":"http:\/\/127.0.0.1:8000\/api\/v2\/language\/9\/","name":"en"}},{"text":"A single-use item to be held by a\nPok\u00e9mon. It allows the immediate use of\na move that charges on the first turn.","version_group":{"url":"http:\/\/127.0.0.1:8000\/api\/v2\/version-group\/9\/","name":"platinum"},"language":{"url":"http:\/\/127.0.0.1:8000\/api\/v2\/language\/9\/","name":"en"}},{"text":"A single-use item to be held by a\nPok\u00e9mon. It allows the immediate use of\na move that charges on the first turn.","version_group":{"url":"http:\/\/127.0.0.1:8000\/api\/v2\/version-group\/8\/","name":"diamond-pearl"},"language":{"url":"http:\/\/127.0.0.1:8000\/api\/v2\/language\/9\/","name":"en"}}],"id":248,"machines":[],"fling_power":10}
