{"category":{"url":"http:\/\/127.0.0.1:8000\/api\/v2\/item-category\/22\/","name":"plot-advancement"},"name":"gold-teeth","fling_effect":null,"effect_entries":[{"short_effect":"The Safari Zone Warden's dentures. Trade for HM04 (Strength).","effect":"The Safari Zone warden's teeth, to be returned to him for hm04.","language":{"url":"http:\/\/127.0.0.1:8000\/api\/v2\/language\/9\/","name":"en"}}],"held_by_pokemon":[],"sprites":{"default":"http:\/\/127.0.0.1:8000\/media\/sprites\/items\/gold-teeth.png"},"game_indices":[{"generation":{"url":"http:\/\/127.0.0.1:8000\/api\/v2\/generation\/3\/","name":"generation-iii"},"game_index":353}],"baby_trigger_for":null,"cost":0,"names":[{"name":"Gold Teeth","language":{"url":"http:\/\/127.0.0.1:8000\/api\/v2\/language\/9\/","name":"en"}},{"name":"Denti d'Oro","language":{"url":"http:\/\/127.0.0.1:8000\/api\/v2\/language\/8\/","name":"it"}},{"name":"Dientes Oro","language":{"url":"http:\/\/127.0.0.1:8000\/api\/v2\/language\/7\/","name":"es"}},{"name":"Goldz\u00e4hne","language":{"url":"http:\/\/127.0.0.1:8000\/api\/v2\/language\/6\/","name":"de"}},{"name":"Dent d'Or","language":{"url":"http:\/\/127.0.0.1:8000\/api\/v2\/language\/5\/","name":"fr"}},{"name":"\u304d\u3093\u306e\u3044\u308c\u3070","language":{"url":"http:\/\/127.0.0.1:8000\/api\/v2\/language\/1\/","name":"ja"}}],"attributes":[],"flavor_text_entries":[{"text":"A set of false teeth lost by the\nSAFARI ZONE\u2019S WARDEN. It makes his\nsmile sparkle.","version_group":{"url":"http:\/\/127.0.0.1:8000\/api\/v2\/version-group\/7\/","name":"firered-leafgreen"},"language":{"url":"http:\/\/127.0.0.1:8000\/api\/v2\/language\/9\/","name":"en"}},{"text":"Gold dentures lost\nby the SAFARI\nZONE\u2019s WARDEN.","version_group":{"url":"http:\/\/127.0.0.1:8000\/api\/v2\/version-group\/6\/","name":"emerald"},"language":{"url":"http:\/\/127.0.0.1:8000\/api\/v2\/language\/9\/","name":"en"}}],"id":546,"machines":[],"fling_power":null}
