{
    "attributes": [],
    "baby_trigger_for": null,
    "category": {
        "name": "event-items",
        "url": "http://127.0.0.1:8000/api/v2/item-category/20/"
    },
    "cost": 0,
    "effect_entries": [
        {
            "effect": "Allows passage on the castelia city ship, which leads to liberty garden and victini.",
            "language": {
                "name": "en",
                "url": "http://127.0.0.1:8000/api/v2/language/9/"
            },
            "short_effect": "Allows access to Liberty Garden and Victini."
        }
    ],
    "flavor_text_entries": [
        {
            "language": {
                "name": "ja-kanji",
                "url": "http://127.0.0.1:8000/api/v2/language/11/"
            },
            "text": "\u30ea\u30d0\u30c6\u30a3\u30ac\u30fc\u30c7\u30f3\u5cf6\u306b\u3000\u884c\u304f\u305f\u3081\u306e\n\u7279\u5225\u306a\u3000\u30c1\u30b1\u30c3\u30c8\u3002\n\u30d2\u30a6\u30f3\u30b7\u30c6\u30a3\u304b\u3089\u3000\u8239\u306b\u3000\u4e57\u308c\u308b\u3002",
            "version_group": {
                "name": "x-y",
                "url": "http://127.0.0.1:8000/api/v2/version-group/15/"
            }
        },
        {
            "language": {
                "name": "en",
                "url": "http://127.0.0.1:8000/api/v2/language/9/"
            },
            "text": "A special pass to go to Liberty Garden.\nBoard the ship in Castelia City.",
            "version_group": {
                "name": "x-y",
                "url": "http://127.0.0.1:8000/api/v2/version-group/15/"
            }
        },
        {
            "language": {
                "name": "it",
                "url": "http://127.0.0.1:8000/api/v2/language/8/"
            },
            "text": "Biglietto speciale per l\u2019Isola Libert\u00e0.\nLa nave parte da Austropoli.",
            "version_group": {
                "name": "x-y",
                "url": "http://127.0.0.1:8000/api/v2/version-group/15/"
            }
        },
        {
            "language": {
                "name": "es",
                "url": "http://127.0.0.1:8000/api/v2/language/7/"
            },
            "text": "Aumenta ligeramente la Velocidad en combate.\nAl cambiar de Pok\u00e9mon, el efecto desaparece.",
            "version_group": {
                "name": "x-y",
                "url": "http://127.0.0.1:8000/api/v2/version-group/15/"
            }
        },
        {
            "language": {
                "name": "de",
                "url": "http://127.0.0.1:8000/api/v2/language/6/"
            },
            "text": "Ein besonderes Ticket f\u00fcr die \u00dcberfahrt von\nStratos City zur Insel des Freiheitsgartens.",
            "version_group": {
                "name": "x-y",
                "url": "http://127.0.0.1:8000/api/v2/version-group/15/"
            }
        },
        {
            "language": {
                "name": "fr",
                "url": "http://127.0.0.1:8000/api/v2/language/5/"
            },
            "text": "Un ticket sp\u00e9cial permettant de se rendre sur\nl\u2019\u00cele Libert\u00e9 \u00e0 bord du bateau de Volucit\u00e9.",
            "version_group": {
                "name": "x-y",
                "url": "http://127.0.0.1:8000/api/v2/version-group/15/"
            }
        },
        {
            "language": {
                "name": "ko",
                "url": "http://127.0.0.1:8000/api/v2/language/3/"
            },
            "text": "\ub9ac\ubc84\ud2f0\uac00\ub4e0\uc12c\uc5d0 \uac00\uae30 \uc704\ud55c\n\ud2b9\ubcc4\ud55c \ud2f0\ucf13.\n\uad6c\ub984\uc2dc\ud2f0\uc5d0\uc11c \ubc30\ub97c \ud0c8 \uc218 \uc788\ub2e4.",
            "version_group": {
                "name": "x-y",
                "url": "http://127.0.0.1:8000/api/v2/version-group/15/"
            }
        },
        {
            "language": {
                "name": "ja",
                "url": "http://127.0.0.1:8000/api/v2/language/1/"
            },
            "text": "\u30ea\u30d0\u30c6\u30a3\u30ac\u30fc\u30c7\u30f3\u3068\u3046\u306b\u3000\u3044\u304f\u305f\u3081\u306e\n\u3068\u304f\u3079\u3064\u306a\u3000\u30c1\u30b1\u30c3\u30c8\u3002\n\u30d2\u30a6\u30f3\u30b7\u30c6\u30a3\u304b\u3089\u3000\u3075\u306d\u306b\u3000\u306e\u308c\u308b\u3002",
            "version_group": {
                "name": "x-y",
                "url": "http://127.0.0.1:8000/api/v2/version-group/15/"
            }
        },
        {
            "language": {
                "name": "en",
                "url": "http://127.0.0.1:8000/api/v2/language/9/"
            },
            "text": "A special pass to go to Liberty Garden.\nBoard the ship in Castelia City.",
            "version_group": {
                "name": "black-2-white-2",
                "url": "http://127.0.0.1:8000/api/v2/version-group/14/"
            }
        },
        {
            "language": {
                "name": "en",
                "url": "http://127.0.0.1:8000/api/v2/language/9/"
            },
            "text": "A special pass to go to Liberty Garden.\nBoard the ship in Castelia City.",
            "version_group": {
                "name": "black-white",
                "url": "http://127.0.0.1:8000/api/v2/version-group/11/"
            }
        },
        {
            "language": {
                "name": "fr",
                "url": "http://127.0.0.1:8000/api/v2/language/5/"
            },
            "text": "Ticket sp\u00e9cial permettant de se\nrendre sur l\u2019\u00cele Libert\u00e9 \u00e0 bord\ndu bateau de Volucit\u00e9.",
            "version_group": {
                "name": "black-white",
                "url": "http://127.0.0.1:8000/api/v2/version-group/11/"
            }
        }
    ],
    "fling_effect": null,
    "fling_power": null,
    "game_indices": [
        {
            "game_index": 574,
            "generation": {
                "name": "generation-vi",
                "url": "http://127.0.0.1:8000/api/v2/generation/6/"
            }
        },
        {
            "game_index": 574,
            "generation": {
                "name": "generation-v",
                "url": "http://127.0.0.1:8000/api/v2/generation/5/"
            }
        }
    ],
    "held_by_pokemon": [],
    "id": 615,
    "machines": [],
    "name": "liberty-pass",
    "names": [
        {
            "language": {
                "name": "en",
                "url": "http://127.0.0.1:8000/api/v2/language/9/"
            },
            "name": "Liberty Pass"
        },
        {
            "language": {
                "name": "it",
                "url": "http://127.0.0.1:8000/api/v2/language/8/"
            },
            "name": "Liberticket"
        },
        {
            "language": {
                "name": "es",
                "url": "http://127.0.0.1:8000/api/v2/language/7/"
            },
            "name": "Tarjeta Libertad"
        },
        {
            "language": {
                "name": "de",
                "url": "http://127.0.0.1:8000/api/v2/language/6/"
            },
            "name": "Gartenpass"
        },
        {
            "language": {
                "name": "fr",
                "url": "http://127.0.0.1:8000/api/v2/language/5/"
            },
            "name": "Pass Libert\u00e9"
        },
        {
            "language": {
                "name": "ko",
                "url": "http://127.0.0.1:8000/api/v2/language/3/"
            },
            "name": "\ub9ac\ubc84\ud2f0\ud2f0\ucf13"
        },
        {
            "language": {
                "name": "ja",
                "url": "http://127.0.0.1:8000/api/v2/language/1/"
            },
            "name": "\u30ea\u30d0\u30c6\u30a3\u30c1\u30b1\u30c3\u30c8"
        }
    ],
    "sprites": {
        "default": "http://127.0.0.1:8000/media/sprites/items/liberty-pass.png"
    }
}
