{"category":{"url":"http:\/\/127.0.0.1:8000\/api\/v2\/item-category\/26\/","name":"vitamins"},"name":"ability-capsule","fling_effect":null,"effect_entries":[],"held_by_pokemon":[],"sprites":{"default":"http:\/\/127.0.0.1:8000\/media\/sprites\/items\/ability-capsule.png"},"game_indices":[{"generation":{"url":"http:\/\/127.0.0.1:8000\/api\/v2\/generation\/6\/","name":"generation-vi"},"game_index":645}],"baby_trigger_for":null,"cost":0,"names":[{"name":"Ability Capsule","language":{"url":"http:\/\/127.0.0.1:8000\/api\/v2\/language\/9\/","name":"en"}},{"name":"Capsula abilit\u00e0","language":{"url":"http:\/\/127.0.0.1:8000\/api\/v2\/language\/8\/","name":"it"}},{"name":"C\u00e1ps. Habilidad","language":{"url":"http:\/\/127.0.0.1:8000\/api\/v2\/language\/7\/","name":"es"}},{"name":"F\u00e4higk.-Kapsel","language":{"url":"http:\/\/127.0.0.1:8000\/api\/v2\/language\/6\/","name":"de"}},{"name":"Pilule Talent","language":{"url":"http:\/\/127.0.0.1:8000\/api\/v2\/language\/5\/","name":"fr"}},{"name":"\ud2b9\uc131\ucea1\uc290","language":{"url":"http:\/\/127.0.0.1:8000\/api\/v2\/language\/3\/","name":"ko"}},{"name":"\u3068\u304f\u305b\u3044\u30ab\u30d7\u30bb\u30eb","language":{"url":"http:\/\/127.0.0.1:8000\/api\/v2\/language\/1\/","name":"ja"}}],"attributes":[],"flavor_text_entries":[{"text":"\uff12\u7a2e\u985e\u306e\u3000\u7279\u6027\u3092\u3000\u6301\u3064\n\u30dd\u30b1\u30e2\u30f3\u306b\u3000\u4f7f\u3046\u3068\u3000\u4eca\u3068\u306f\u9055\u3046\n\u7279\u6027\u306b\u3000\u5909\u3048\u3089\u308c\u308b\u3000\u30ab\u30d7\u30bb\u30eb\u3002","version_group":{"url":"http:\/\/127.0.0.1:8000\/api\/v2\/version-group\/15\/","name":"x-y"},"language":{"url":"http:\/\/127.0.0.1:8000\/api\/v2\/language\/11\/","name":"ja-kanji"}},{"text":"A capsule that allows a Pok\u00e9mon with\ntwo Abilities to switch between these\nAbilities when it is used.","version_group":{"url":"http:\/\/127.0.0.1:8000\/api\/v2\/version-group\/15\/","name":"x-y"},"language":{"url":"http:\/\/127.0.0.1:8000\/api\/v2\/language\/9\/","name":"en"}},{"text":"Se usata su un Pok\u00e9mon che ha due abilit\u00e0,\nquesta capsula permette di cambiare quella\nattiva.","version_group":{"url":"http:\/\/127.0.0.1:8000\/api\/v2\/version-group\/15\/","name":"x-y"},"language":{"url":"http:\/\/127.0.0.1:8000\/api\/v2\/language\/8\/","name":"it"}},{"text":"Una de las misteriosas Megapiedras. Permite\nmegaevolucionar a Blaziken en combate.","version_group":{"url":"http:\/\/127.0.0.1:8000\/api\/v2\/version-group\/15\/","name":"x-y"},"language":{"url":"http:\/\/127.0.0.1:8000\/api\/v2\/language\/7\/","name":"es"}},{"text":"Bei Anwendung auf ein Pok\u00e9mon, das zwei\nverschiedene F\u00e4higkeiten haben kann, wird seine\naktuelle F\u00e4higkeit mit der anderen ausgewechselt.","version_group":{"url":"http:\/\/127.0.0.1:8000\/api\/v2\/version-group\/15\/","name":"x-y"},"language":{"url":"http:\/\/127.0.0.1:8000\/api\/v2\/language\/6\/","name":"de"}},{"text":"Une capsule permettant \u00e0 un Pok\u00e9mon pouvant\navoir deux talents de changer de l\u2019un \u00e0 l\u2019autre.","version_group":{"url":"http:\/\/127.0.0.1:8000\/api\/v2\/version-group\/15\/","name":"x-y"},"language":{"url":"http:\/\/127.0.0.1:8000\/api\/v2\/language\/5\/","name":"fr"}},{"text":"2\uc885\ub958\uc758 \ud2b9\uc131\uc744 \uac00\uc9c4\n\ud3ec\ucf13\ubaac\uc5d0\uac8c \uc0ac\uc6a9\ud558\uba74 \uc9c0\uae08\uacfc\ub294 \ub2e4\ub978\n\ud2b9\uc131\uc73c\ub85c \ubc14\uafc0 \uc218 \uc788\ub294 \ucea1\uc290.","version_group":{"url":"http:\/\/127.0.0.1:8000\/api\/v2\/version-group\/15\/","name":"x-y"},"language":{"url":"http:\/\/127.0.0.1:8000\/api\/v2\/language\/3\/","name":"ko"}},{"text":"\uff12\u3057\u3085\u308b\u3044\u306e\u3000\u3068\u304f\u305b\u3044\u3092\u3000\u3082\u3064\n\u30dd\u30b1\u30e2\u30f3\u306b\u3000\u3064\u304b\u3046\u3068\u3000\u3044\u307e\u3068\u306f\u3061\u304c\u3046\n\u3068\u304f\u305b\u3044\u306b\u3000\u304b\u3048\u3089\u308c\u308b\u3000\u30ab\u30d7\u30bb\u30eb\u3002","version_group":{"url":"http:\/\/127.0.0.1:8000\/api\/v2\/version-group\/15\/","name":"x-y"},"language":{"url":"http:\/\/127.0.0.1:8000\/api\/v2\/language\/1\/","name":"ja"}}],"id":685,"machines":[],"fling_power":null}
