{"category":{"url":"http:\/\/127.0.0.1:8000\/api\/v2\/item-category\/16\/","name":"training"},"name":"amulet-coin","fling_effect":null,"effect_entries":[{"short_effect":"Held: Doubles the money earned from a battle. Does not stack with Luck Incense.","effect":"Held\n:   If the holder participated in a trainer battle, the trainer earns twice the usual prize money.  This effect applies even if the holder fainted.\n\n    This effect does not stack with any other similar effect.","language":{"url":"http:\/\/127.0.0.1:8000\/api\/v2\/language\/9\/","name":"en"}}],"held_by_pokemon":[],"sprites":{"default":"http:\/\/127.0.0.1:8000\/media\/sprites\/items\/amulet-coin.png"},"game_indices":[{"generation":{"url":"http:\/\/127.0.0.1:8000\/api\/v2\/generation\/6\/","name":"generation-vi"},"game_index":223},{"generation":{"url":"http:\/\/127.0.0.1:8000\/api\/v2\/generation\/5\/","name":"generation-v"},"game_index":223},{"generation":{"url":"http:\/\/127.0.0.1:8000\/api\/v2\/generation\/4\/","name":"generation-iv"},"game_index":223},{"generation":{"url":"http:\/\/127.0.0.1:8000\/api\/v2\/generation\/3\/","name":"generation-iii"},"game_index":189}],"baby_trigger_for":null,"cost":100,"names":[{"name":"Amulet Coin","language":{"url":"http:\/\/127.0.0.1:8000\/api\/v2\/language\/9\/","name":"en"}},{"name":"Monetamuleto","language":{"url":"http:\/\/127.0.0.1:8000\/api\/v2\/language\/8\/","name":"it"}},{"name":"Moneda Amuleto","language":{"url":"http:\/\/127.0.0.1:8000\/api\/v2\/language\/7\/","name":"es"}},{"name":"M\u00fcnzamulett","language":{"url":"http:\/\/127.0.0.1:8000\/api\/v2\/language\/6\/","name":"de"}},{"name":"Pi\u00e8ce Rune","language":{"url":"http:\/\/127.0.0.1:8000\/api\/v2\/language\/5\/","name":"fr"}},{"name":"\ubd80\uc801\uae08\ud654","language":{"url":"http:\/\/127.0.0.1:8000\/api\/v2\/language\/3\/","name":"ko"}},{"name":"\u304a\u307e\u3082\u308a\u3053\u3070\u3093","language":{"url":"http:\/\/127.0.0.1:8000\/api\/v2\/language\/1\/","name":"ja"}}],"attributes":[{"url":"http:\/\/127.0.0.1:8000\/api\/v2\/item-attribute\/5\/","name":"holdable"},{"url":"http:\/\/127.0.0.1:8000\/api\/v2\/item-attribute\/7\/","name":"holdable-active"}],"flavor_text_entries":[{"text":"\u6301\u305f\u305b\u305f\u3000\u30dd\u30b1\u30e2\u30f3\u304c\u3000\uff11\u5ea6\u3067\u3082\n\u6226\u95d8\u306b\u3000\u9854\u3092\u3000\u3060\u3059\u3068\n\u304a\u91d1\u304c\u3000\uff12\u500d\u3000\u3082\u3089\u3048\u308b\u3002","version_group":{"url":"http:\/\/127.0.0.1:8000\/api\/v2\/version-group\/15\/","name":"x-y"},"language":{"url":"http:\/\/127.0.0.1:8000\/api\/v2\/language\/11\/","name":"ja-kanji"}},{"text":"An item to be held by a Pok\u00e9mon.\nIt doubles any prize money received\nif the holding Pok\u00e9mon joins a battle.","version_group":{"url":"http:\/\/127.0.0.1:8000\/api\/v2\/version-group\/15\/","name":"x-y"},"language":{"url":"http:\/\/127.0.0.1:8000\/api\/v2\/language\/9\/","name":"en"}},{"text":"Strumento da dare a un Pok\u00e9mon.\nSe chi ce l\u2019ha partecipa alla lotta, i guadagni\nraddoppiano.","version_group":{"url":"http:\/\/127.0.0.1:8000\/api\/v2\/version-group\/15\/","name":"x-y"},"language":{"url":"http:\/\/127.0.0.1:8000\/api\/v2\/language\/8\/","name":"it"}},{"text":"Debe llevarlas un Pok\u00e9mon. Fortalecen los\nmovimientos de tipo Siniestro.","version_group":{"url":"http:\/\/127.0.0.1:8000\/api\/v2\/version-group\/15\/","name":"x-y"},"language":{"url":"http:\/\/127.0.0.1:8000\/api\/v2\/language\/7\/","name":"es"}},{"text":"Ein Item, das von einem Pok\u00e9mon getragen wird\nund das doppeltes Preisgeld bringt, wenn der\nTr\u00e4ger am Kampf teilnimmt.","version_group":{"url":"http:\/\/127.0.0.1:8000\/api\/v2\/version-group\/15\/","name":"x-y"},"language":{"url":"http:\/\/127.0.0.1:8000\/api\/v2\/language\/6\/","name":"de"}},{"text":"Objet \u00e0 tenir. Double l\u2019argent gagn\u00e9 si le porteur\nse joint au combat.","version_group":{"url":"http:\/\/127.0.0.1:8000\/api\/v2\/version-group\/15\/","name":"x-y"},"language":{"url":"http:\/\/127.0.0.1:8000\/api\/v2\/language\/5\/","name":"fr"}},{"text":"\uc9c0\ub2c8\uac8c \ud55c \ud3ec\ucf13\ubaac\uc774\n\ud55c \ubc88\uc774\ub77c\ub3c4 \ubc30\ud2c0\uc5d0 \ub098\uac00\uba74\n\ub3c8\uc744 2\ubc30\ub85c \ubc1b\uc744 \uc218 \uc788\ub2e4.","version_group":{"url":"http:\/\/127.0.0.1:8000\/api\/v2\/version-group\/15\/","name":"x-y"},"language":{"url":"http:\/\/127.0.0.1:8000\/api\/v2\/language\/3\/","name":"ko"}},{"text":"\u3082\u305f\u305b\u305f\u3000\u30dd\u30b1\u30e2\u30f3\u304c\u3000\u3044\u3061\u3069\u3067\u3082\n\u305b\u3093\u3068\u3046\u306b\u3000\u304b\u304a\u3092\u3000\u3060\u3059\u3068\n\u304a\u304b\u306d\u304c\u3000\uff12\u3070\u3044\u3000\u3082\u3089\u3048\u308b\u3002","version_group":{"url":"http:\/\/127.0.0.1:8000\/api\/v2\/version-group\/15\/","name":"x-y"},"language":{"url":"http:\/\/127.0.0.1:8000\/api\/v2\/language\/1\/","name":"ja"}},{"text":"An item to be held by a Pok\u00e9mon.\nIt doubles a battle\u2019s prize money if\nthe holding Pok\u00e9mon joins in.","version_group":{"url":"http:\/\/127.0.0.1:8000\/api\/v2\/version-group\/14\/","name":"black-2-white-2"},"language":{"url":"http:\/\/127.0.0.1:8000\/api\/v2\/language\/9\/","name":"en"}},{"text":"An item to be held by a Pok\u00e9mon.\nIt doubles a battle\u2019s prize money if\nthe holding Pok\u00e9mon joins in.","version_group":{"url":"http:\/\/127.0.0.1:8000\/api\/v2\/version-group\/11\/","name":"black-white"},"language":{"url":"http:\/\/127.0.0.1:8000\/api\/v2\/language\/9\/","name":"en"}},{"text":"Objet \u00e0 tenir. Double l\u2019argent gagn\u00e9\nsi le porteur se joint au combat.","version_group":{"url":"http:\/\/127.0.0.1:8000\/api\/v2\/version-group\/11\/","name":"black-white"},"language":{"url":"http:\/\/127.0.0.1:8000\/api\/v2\/language\/5\/","name":"fr"}},{"text":"An item to be held by a Pok\u00e9mon.\nIt doubles a battle\u2019s prize money if\nthe holding Pok\u00e9mon joins in.","version_group":{"url":"http:\/\/127.0.0.1:8000\/api\/v2\/version-group\/10\/","name":"heartgold-soulsilver"},"language":{"url":"http:\/\/127.0.0.1:8000\/api\/v2\/language\/9\/","name":"en"}},{"text":"An item to be held by a Pok\u00e9mon.\nIt doubles a battle\u2019s prize money if\nthe holding Pok\u00e9mon joins in.","version_group":{"url":"http:\/\/127.0.0.1:8000\/api\/v2\/version-group\/9\/","name":"platinum"},"language":{"url":"http:\/\/127.0.0.1:8000\/api\/v2\/language\/9\/","name":"en"}},{"text":"An item to be held by a Pok\u00e9mon.\nIt doubles a battle\u2019s prize money if\nthe holding Pok\u00e9mon joins in.","version_group":{"url":"http:\/\/127.0.0.1:8000\/api\/v2\/version-group\/8\/","name":"diamond-pearl"},"language":{"url":"http:\/\/127.0.0.1:8000\/api\/v2\/language\/9\/","name":"en"}},{"text":"An item to be held by a POK\u00e9MON.\nIt doubles the battle money if the\nholding POK\u00e9MON takes part.","version_group":{"url":"http:\/\/127.0.0.1:8000\/api\/v2\/version-group\/7\/","name":"firered-leafgreen"},"language":{"url":"http:\/\/127.0.0.1:8000\/api\/v2\/language\/9\/","name":"en"}},{"text":"Doubles money in\nbattle if the\nholder takes part.","version_group":{"url":"http:\/\/127.0.0.1:8000\/api\/v2\/version-group\/6\/","name":"emerald"},"language":{"url":"http:\/\/127.0.0.1:8000\/api\/v2\/language\/9\/","name":"en"}},{"text":"Doubles money in\nbattle if the holder\ntakes part.","version_group":{"url":"http:\/\/127.0.0.1:8000\/api\/v2\/version-group\/5\/","name":"ruby-sapphire"},"language":{"url":"http:\/\/127.0.0.1:8000\/api\/v2\/language\/9\/","name":"en"}}],"id":200,"machines":[],"fling_power":30}
