{"category":{"url":"http:\/\/127.0.0.1:8000\/api\/v2\/item-category\/22\/","name":"plot-advancement"},"name":"rainbow-wing","fling_effect":null,"effect_entries":[{"short_effect":"Summons Ho-Oh at the top of the Bell Tower.","effect":"Causes ho oh to appear at the top of bell tower.","language":{"url":"http:\/\/127.0.0.1:8000\/api\/v2\/language\/9\/","name":"en"}}],"held_by_pokemon":[],"sprites":{"default":"http:\/\/127.0.0.1:8000\/media\/sprites\/items\/rainbow-wing.png"},"game_indices":[{"generation":{"url":"http:\/\/127.0.0.1:8000\/api\/v2\/generation\/6\/","name":"generation-vi"},"game_index":483},{"generation":{"url":"http:\/\/127.0.0.1:8000\/api\/v2\/generation\/5\/","name":"generation-v"},"game_index":483},{"generation":{"url":"http:\/\/127.0.0.1:8000\/api\/v2\/generation\/4\/","name":"generation-iv"},"game_index":483}],"baby_trigger_for":null,"cost":0,"names":[{"name":"Rainbow Wing","language":{"url":"http:\/\/127.0.0.1:8000\/api\/v2\/language\/9\/","name":"en"}},{"name":"Ala d'Iride","language":{"url":"http:\/\/127.0.0.1:8000\/api\/v2\/language\/8\/","name":"it"}},{"name":"Ala Arco\u00edris","language":{"url":"http:\/\/127.0.0.1:8000\/api\/v2\/language\/7\/","name":"es"}},{"name":"Buntschwinge","language":{"url":"http:\/\/127.0.0.1:8000\/api\/v2\/language\/6\/","name":"de"}},{"name":"Arcenci'Aile","language":{"url":"http:\/\/127.0.0.1:8000\/api\/v2\/language\/5\/","name":"fr"}},{"name":"\ubb34\uc9c0\uac2f\ube5b\ub0a0\uac1c","language":{"url":"http:\/\/127.0.0.1:8000\/api\/v2\/language\/3\/","name":"ko"}},{"name":"\u306b\u3058\u3044\u308d\u306e\u306f\u306d","language":{"url":"http:\/\/127.0.0.1:8000\/api\/v2\/language\/1\/","name":"ja"}}],"attributes":[],"flavor_text_entries":[{"text":"\u306b\u3058\u3044\u308d\u306b\u3000\u3072\u304b\u308a\u3000\u304b\u304c\u3084\u304f\n\u4e0d\u601d\u8b70\u306a\u3000\u306f\u306d\u3002\n","version_group":{"url":"http:\/\/127.0.0.1:8000\/api\/v2\/version-group\/15\/","name":"x-y"},"language":{"url":"http:\/\/127.0.0.1:8000\/api\/v2\/language\/11\/","name":"ja-kanji"}},{"text":"A mystical rainbow feather\nthat sparkles.","version_group":{"url":"http:\/\/127.0.0.1:8000\/api\/v2\/version-group\/15\/","name":"x-y"},"language":{"url":"http:\/\/127.0.0.1:8000\/api\/v2\/language\/9\/","name":"en"}},{"text":"Piuma magica dai mille colori.","version_group":{"url":"http:\/\/127.0.0.1:8000\/api\/v2\/version-group\/15\/","name":"x-y"},"language":{"url":"http:\/\/127.0.0.1:8000\/api\/v2\/language\/8\/","name":"it"}},{"text":"Lector con el que se pueden escuchar aquellas\ncanciones tan nost\u00e1lgicas. Se cambia con un solo\ninterruptor.","version_group":{"url":"http:\/\/127.0.0.1:8000\/api\/v2\/version-group\/15\/","name":"x-y"},"language":{"url":"http:\/\/127.0.0.1:8000\/api\/v2\/language\/7\/","name":"es"}},{"text":"Eine mystische Feder, die von einem\nregenbogenfarbenen Leuchten erf\u00fcllt ist.","version_group":{"url":"http:\/\/127.0.0.1:8000\/api\/v2\/version-group\/15\/","name":"x-y"},"language":{"url":"http:\/\/127.0.0.1:8000\/api\/v2\/language\/6\/","name":"de"}},{"text":"Une \u00e9trange plume qui brille d\u2019un \u00e9clat\narc-en-ciel.","version_group":{"url":"http:\/\/127.0.0.1:8000\/api\/v2\/version-group\/15\/","name":"x-y"},"language":{"url":"http:\/\/127.0.0.1:8000\/api\/v2\/language\/5\/","name":"fr"}},{"text":"\ubb34\uc9c0\uac2f\ube5b\uc73c\ub85c \ube5b\ub098\ub294\n\uc774\uc0c1\ud55c \ub0a0\uac1c.","version_group":{"url":"http:\/\/127.0.0.1:8000\/api\/v2\/version-group\/15\/","name":"x-y"},"language":{"url":"http:\/\/127.0.0.1:8000\/api\/v2\/language\/3\/","name":"ko"}},{"text":"\u306b\u3058\u3044\u308d\u306b\u3000\u3072\u304b\u308a\u3000\u304b\u304c\u3084\u304f\n\u3075\u3057\u304e\u306a\u3000\u306f\u306d\u3002\n","version_group":{"url":"http:\/\/127.0.0.1:8000\/api\/v2\/version-group\/15\/","name":"x-y"},"language":{"url":"http:\/\/127.0.0.1:8000\/api\/v2\/language\/1\/","name":"ja"}},{"text":"A mystical rainbow feather\nthat sparkles.","version_group":{"url":"http:\/\/127.0.0.1:8000\/api\/v2\/version-group\/14\/","name":"black-2-white-2"},"language":{"url":"http:\/\/127.0.0.1:8000\/api\/v2\/language\/9\/","name":"en"}},{"text":"A mystical rainbow feather\nthat sparkles.","version_group":{"url":"http:\/\/127.0.0.1:8000\/api\/v2\/version-group\/11\/","name":"black-white"},"language":{"url":"http:\/\/127.0.0.1:8000\/api\/v2\/language\/9\/","name":"en"}},{"text":"Une \u00e9trange plume qui brille\nd\u2019un \u00e9clat arc-en-ciel.","version_group":{"url":"http:\/\/127.0.0.1:8000\/api\/v2\/version-group\/11\/","name":"black-white"},"language":{"url":"http:\/\/127.0.0.1:8000\/api\/v2\/language\/5\/","name":"fr"}},{"text":"A mystical, rainbow feather\nthat sparkles.","version_group":{"url":"http:\/\/127.0.0.1:8000\/api\/v2\/version-group\/10\/","name":"heartgold-soulsilver"},"language":{"url":"http:\/\/127.0.0.1:8000\/api\/v2\/language\/9\/","name":"en"}}],"id":482,"machines":[],"fling_power":null}
